Start Date,Start Time,End Date,End Time,Duration,Location,Track,Title,Presenters,Book Description,All Day Event,Private,AV Needs
4/24/2015,16:00,4/24/2015,16:50,50 minutes,"Algonquin D","Tech","Practical Home Networking Using a Linux Router","Tony Bemus","It is becoming common these days for people to have a home network. But doing it with open software is even better. Come and learn from the host of Sunday Morning Linux Review.",FALSE,PUBLIC,"Projector"
4/24/2015,17:00,4/24/2015,17:50,50 minutes,"Algonquin D","Tech","An Introduction to Docker: What are Linux Containers?","Nathan LeClaire","Heard about Docker and curious to know more? In this talk Nathan LeClaire- an engineer at Docker Inc.- will go over some of the 'what'- 'why'- and 'how' of Linux containers. Docker has emerged as an exciting new way for developers to build- ship- and run applications and eliminate the pain of moving them from computer to computer. We will be going over the fundamentals- as well as the direction the technology will be heading in the future.",FALSE,PUBLIC,"Projector"
4/24/2015,18:00,4/24/2015,18:50,50 minutes,"Algonquin D","Tech","I2P Invisible Internet Project","Pat Baker","The Invisible Internet Project (I2P) is a computer network layer that allows applications to send messages to each other pseudonymously and securely. Uses include anonymous Web surfing- chatting- blogging and file transfers.",FALSE,PUBLIC,"Projector"
4/24/2015,19:00,4/24/2015,19:50,50 minutes,"Algonquin D","Science","The Dawn Mission at Dwarf Planet Ceres","Bob Trembley","The Dawn spacecraft will approach the Dwarf Planet Ceres in February of 2015- and go into orbit of Ceres in the Spring of 2015. In this lecture- Bob discusses the Dawn spacecraft and its ion propulsion system- its 2011 visit to the asteroid Vesta- and new photos and scientific findings about Ceres. It- and several other 'planets' got demoted to asteroid status in the 1850's. Ceres' status was updated to 'Dwarf Planet' in 2006- along with Pluto.",FALSE,PUBLIC,"Projector"
4/24/2015,20:00,4/24/2015,20:50,50 minutes,"Algonquin D","Science","The Future of Bionics","Cynthia Chestek, Albert Manero, Ivan Owen, Aaron Brown","In the beginning- bionics were expensive things sold by large companies. Now- we're 3D printing them for less than a fancy dinner- and soon- we're going to be controlling them with our minds! What will the future hold for people who use these devices to make their lives richer? Will we be bionic people? Will we be better...stronger...faster?",FALSE,PUBLIC,"none"
4/24/2015,21:00,4/24/2015,21:50,50 minutes,"Algonquin D","Tech","Continuous Delivery: Make Software Config and Deployment Quick and Painless","Mark Henke","We are going to explore continuous delivery as a solution to the arduous problems of configuration and deployment management. Begone long hours of painful- error-prone releases! This method should make config and deployment- painless- easy and quick. This is an intermediate level topic for those familiar with software development.",FALSE,PUBLIC,"Projector"
