Subject,Start Date,Start Time,End Date,End Time,All Day Event,Description,Location,Private
"First Things First: Story Titles ",4/30/2016,10:00,4/30/2016,10:50,FALSE,"First Things First: Story Titles: Which comes first, a story or its title? What makes a good title? Who gets to decide what that title would be? Should a title hint at the story to come, or only make sense after the story is read?   Speakers include:Jon David, Alex Kourvo, Christine Daigle, Michael Cieslak - Track: Literature  - Duration: 50 minutes - Audio/video needs: none ","Windover",PUBLIC
"Self-Publishing 2016",5/1/2016,10:00,5/1/2016,10:50,FALSE,"This panel discusses today's self-publishing options and business models. Our panelists include authors who are both self- and traditionally published, in fiction and nonfiction, including people who are making an income entirely by self-publishing. We'll discuss why we made the choice to self-publish, the pitfalls and lessons learned, and which business choices we've made on our respective self-publishing efforts.  Speakers include:Michael W. Lucas, Jen Haeger, Christopher Purrett, Alex Kourvo, Robert Kroese - Track: Literature  - Duration: 50 minutes - Audio/video needs: none ","EMC I",PUBLIC
"SF/F Madlibs",4/30/2016,21:00,4/30/2016,21:50,FALSE,"Enjoy science fiction, fantasy, and pop culture Mad-libs created by our panelists. Offer up some interesting nouns, adj, verbs and adverbs and be prepared to laugh your head off!  Speakers include:Andrea Johnson, Ferrett Steinmetz, Jackie Morgan, Jen Haeger, Alex Kourvo - Track: Literature  - Duration: 50 minutes - Audio/video needs: none ","Charlevoix C",PUBLIC
"Social media for writers",4/29/2016,18:00,4/29/2016,18:50,FALSE,"What social media trends does a writer building their web footprint need to understand? What are some Dos and Don'ts?  Speakers include:David Erik Nelson, Andrea Johnson, Michael W. Lucas, Christopher Purrett, Alex Kourvo - Track: Literature  - Duration: 50 minutes - Audio/video needs: none ","Hamlin",PUBLIC
"Writing Fast and Slow",4/30/2016,16:00,4/30/2016,16:50,FALSE,"Are you a hack if you write quickly? Are you an amateur if you write slowly? How many books a year should a working writer produce, and how has that expectation changed in today’s publishing climate? How quickly do readers want—or expect—the next book?  Speakers include:Alex Kourvo, Jen Haeger, Jim Leach, Cathrynne Valente - Track: Literature  - Duration: 50 minutes - Audio/video needs: none ","Charlevoix C",PUBLIC
