Subject,Start Date,Start Time,End Date,End Time,All Day Event,Description,Location,Private
"Can I Get Some Trope Fries with My Trope and a Side of Trope Sauce?",5/3/2019,17:00,5/3/2019,18:00,FALSE,"Tropes are tropes, but are readers still eating them up? A discussion of all things trope.  Speakers include:Cassandra Morgan, Jen Haeger - Track: Lit  - Duration: 1 hour ","Montcalm",PUBLIC
"The Importance of Animals",5/4/2019,09:00,5/4/2019,10:00,FALSE,"From sentient characters to plucky sidekicks, animals have been featured in SFF since its inception. This talk will discuss which animal characters work, which don't, and perhaps how to create your own believable, non-human characters.  Speakers include:Cassandra Morgan, Michael Cieslak - Track: Lit  - Duration: 1 hour ","Charlevoix A",PUBLIC
"Office Hours with Cassandra Morgan",5/4/2019,10:00,5/4/2019,11:00,FALSE,"Have a question about life, the universe, or publishing? Come chat with the author and find out all the answers to your burning questions.  Speakers include:Cassandra Morgan - Track: Lit  - Duration: 1 hour ","Writer's Block ",PUBLIC
"Feline Nutrition 101",5/4/2019,12:00,5/4/2019,13:00,FALSE,"Cats have been steadily growing in popularity for decades. Join Cassandra Morgan, author and feline nutrition and behavior consultant, as she walks you through the basics of feline nutrition. Learn how to read a pet food label, what it means to be an obligate carnivore, and settle the great kibble vs canned debate. It's going to be a purr-fectly meow-velous time!  Speakers include:Cassandra Morgan - Track: Science  - Duration: 1 hour ","Portage Auditorium",PUBLIC
"Reading: Cassandra Morgan",5/4/2019,16:00,5/4/2019,17:00,FALSE,"The authors read from their works.  Speakers include:Cassandra Morgan - Track: Lit  - Duration: 1 hour ","Author Readings Room",PUBLIC
"Subversive Fairy Tales",5/4/2019,18:00,5/4/2019,19:00,FALSE,"Modern literature has rediscovered fairy tales, but these aren't your typical Brother's Grimm stories. They're darker, grittier, and you might not get the happy ending you expected. Come see how fairy tales have grown up, and how they might be closer to their original forms than the ones you knew as a child.  Speakers include:Janea Schimmel, Cassandra Morgan - Track: Lit  - Duration: 1 hour ","Charlevoix B",PUBLIC
"You're Only as Good as Your Villain is Bad",5/5/2019,09:00,5/5/2019,10:00,FALSE,"Every good heroine needs an appropriate villain. We've all heard the old saw that everyone is the hero in their own story, but what goes in to writing a believable villain? Come explore the dark side!  Speakers include:Cassandra Morgan, Michael Cieslak - Track: Lit  - Duration: 1 hour ","Nicolet",PUBLIC
