Subject,Start Date,Start Time,End Date,End Time,All Day Event,Description,Location,Private
"Opening Ceremonies",4/29/2016,18:00,4/29/2016,18:50,FALSE,"Join our con chair, Scott Kennedy, the Con Committee, and our Guests of Honor as we open this bad boy up for the weekend.  You never know what surprises might be in store!  Speakers include:Scott Kennedy, Daniel Dugan, Nuri Gocay, Cylithria Dubois, Amanda Long-Adams, Amanda Robinson, Miranda Webster, Jessica Roland, Julie Winningham, Ann Lemay, Ann Leckie, Catherynne Valente, Deb Nicholson, Jason Mars, Lingjia Tang - Track: Penguicon  - Duration: 50 minutes - Audio/video needs: none ","Algonquin B/C",PUBLIC
"Social Hour ",4/29/2016,21:00,4/29/2016,21:50,FALSE,"Get to know our Guests of Honor and Featured Guests as we all get together for some cocktails. Meet us in the bar!  Speakers include:Ann Lemay, Ann Leckie, Catherynne Valente, Deb Nicholson, Jason Mars, Lingjia Tang - Track: Penguicon  - Duration: 50 minutes - Audio/video needs: none ","Restaurant",PUBLIC
"KaffeKlatsch with Catherynne Valente",4/30/2016,9:00,4/30/2016,9:50,FALSE,"Join Guest of Honor Catherynne Valente for coffee and chatting!  This is a limited attendance event.  Please sign up in advance at Ops.  Speakers include:Catherynne Valente - Track: Literature  - Duration: 50 minutes - Audio/video needs: none ","Restaurant",PUBLIC
"Evoking Emotions, Provoking Readers",4/30/2016,12:00,4/30/2016,12:50,FALSE,"Creating authentic characters who seem to experience a full range of believable emotions is only half the equation in character-building.  How can we use character emotions to evoke real feelings in our readers? What other tricks are there?  Speakers include:Merrie Haskell, Cindy Spencer Pape, Ken MacGregor, Catherynne Valente, Mark Oshiro - Track: Literature  - Duration: 50 minutes - Audio/video needs: none ","EMC I",PUBLIC
"A Writer's Life",4/30/2016,13:00,4/30/2016,13:50,FALSE,"How do you handle the daily mechanics of hammering your magical, sparking, glittering craft into the finished product that could sell. What practical habits foster the creative process on a daily basis and how do you manage the emotional blender that is making words ready for publishing?   Speakers include:Tobias S. Buckell, Ferrett Steinmetz, Catherynne Valente, Dave Klecha, Andrew Zimmerman Jones - Track: Literature  - Duration: 50 minutes - Audio/video needs: none ","Algonquin D",PUBLIC
"Writing Fast and Slow",4/30/2016,16:00,4/30/2016,16:50,FALSE,"Are you a hack if you write quickly? Are you an amateur if you write slowly? How many books a year should a working writer produce, and how has that expectation changed in todays publishing climate? How quickly do readers want or expect the next book?  Speakers include:Alex Kourvo, Jen Haeger, Jim Leach, Catherynne Valente, Jeff Pryor - Track: Literature  - Duration: 50 minutes - Audio/video needs: none ","Charlevoix C",PUBLIC
"Diversity in Geek Media",4/30/2016,18:00,4/30/2016,18:50,FALSE,"The push for more diversity has become a regular topic in the world of genre media and games, from calling out instances of white-washing and queer-baiting, to protesting the inevitable and often inexplicable deaths of queer characters and characters of color. It's an exhausting road, but is it actually leading to more diverse and inclusive media?  Speakers include:Tanya DePass, Ann Lemay, Lingjia Tang, Mark Oshiro, Catherynne Valente, Mari Brighe - Track: Media  - Duration: 50 minutes - Audio/video needs: none ","Charlevoix B",PUBLIC
"Catherynne Valente Reading",5/1/2016,11:00,5/1/2016,11:50,FALSE,"Join Guest of Honor Catherynne Valente for a reading and a chance to have your books signed.  Speakers include:Catherynne Valente - Track: Literature  - Duration: 50 minutes - Audio/video needs: none ","Montcalm",PUBLIC
"Closing Ceremonies",5/1/2016,16:00,5/1/2016,16:50,FALSE,"As we officially shut down another amazing, exciting year for Penguicon, come hear about how it went, and what we've got our eye on for next year.  Speakers include:Scott Kennedy, Daniel Dugan, Nuri Gocay, Cylithria Dubois, Amanda Long-Adams, Amanda Robinson, Miranda Webster, Jessica Roland, Julie Winningham, Ann Lemay, Ann Leckie, Catherynne Valente, Deb Nicholson, Jason Mars, Lingjia Tang - Track: Penguicon  - Duration: 50 minutes - Audio/video needs: none ","Algonquin B/C",PUBLIC
