Subject,Start Date,Start Time,End Date,End Time,All Day Event,Description,Location,Private
"Virtual Reality Headset Demo with Game Face Labs",4/24/2015,19:00,4/24/2015,19:50,FALSE,"Come try Game Face Labs’ newest 3D printed, Android based, wireless virtual reality headset. It has a 2.5k pixel display, it runs native 3D movies, and does 2D to 3D conversion on the fly, all on Android! You know you want to take a peek.  Speakers include:Ed Mason - Track: Tech  - Duration: 50 minutes - Audio/video needs: none ","Lobby [Near Elevators]",PUBLIC
"Virtual Reality Headset Demo with Game Face Labs",4/25/2015,12:00,4/25/2015,12:50,FALSE,"Come try Game Face Labs’ newest 3D printed, Android based, wireless virtual reality headset. It has a 2.5k pixel display, it runs native 3D movies, and does 2D to 3D conversion on the fly, all on Android! You know you want to take a peek.  Speakers include:Ed Mason - Track: Tech  - Duration: 50 minutes - Audio/video needs: none ","Lobby [Near Elevators]",PUBLIC
"Neal Stephenson’s Metaverse - Science Fiction, or near Reality?",4/25/2015,16:00,4/25/2015,16:50,FALSE,"In Stephenson’s Snow Crash (which was written in 1992, mind you!) the Metaverse was a futuristic version of the internet based on virtual reality, augmentations, cryptocurrencies, and corporations run amok. Individually, these themes are all very relevant and very real — but are we on the way to alternate realities powered by these emerging techs? What could the future look like? Did Neal Stephenson get it right more than 20 years ago?  Speakers include:Amal Graafstra, Jared Ficklin, Ed Mason, Cynthia Chestek - Track: Tech  - Duration: 50 minutes - Audio/video needs: none ","Algonquin B",PUBLIC
"Independent SW/HW: Bucking Big Industry for Fun and Profit",4/25/2015,21:00,4/25/2015,21:50,FALSE,"Sure, there are juggernauts in software and hardware industry, but if you want to do it yourself, what kinds of challenges are you going to run into?  Come listen to our panelists talk about their experiences with going against the grain as independent software and hardware producers.    Speakers include:Aral Balkan, Ed Mason, Jason Kridner - Track: Tech  - Duration: 50 minutes - Audio/video needs: none ","Algonquin D",PUBLIC
"Virtual Reality Headset Demo with Game Face Labs",4/26/2015,12:00,4/26/2015,12:50,FALSE,"Come try Game Face Labs’ newest 3D printed, Android based, wireless virtual reality headset. It has a 2.5k pixel display, it runs native 3D movies, and does 2D to 3D conversion on the fly, all on Android! You know you want to take a peek.  Speakers include:Ed Mason - Track: Tech  - Duration: 50 minutes - Audio/video needs: none ","Lobby [Near Elevators]",PUBLIC
"Science Fiction is Now Science Reality",4/26/2015,13:00,4/26/2015,13:50,FALSE,"Science fiction authors have been writing about futuristic concepts for longer than any of us can remember.  Moore's law, though, has us flying into the future at speeds faster than what any of us have previously comprehended.  Things only imagined by creative minds are coming to reality in exciting, and sometimes terrifying ways.  Come join some authors and technologists as they talk about science fiction themes that are now a reality and what's coming next!  Speakers include:Annalee Newitz, Ed Mason, Karl Schroeder, Charlie Jane Anders, Jen Haeger - Track: Science, Literature  - Duration: 50 minutes - Audio/video needs: none ","Windover",PUBLIC
