Subject,Start Date,Start Time,End Date,End Time,All Day Event,Description,Location,Private
"Introduction to Exoplanet Art with the GIMP 1",4/30/2016,14:00,4/30/2016,14:50,FALSE,"Missions like the Kepler telescope have shown our galaxy be home to countless exoplanets, but it is still up to artists to imagine how these planets.  Discover how easy it is for someone with no artistic experience to create beautiful exoplanet images with the open source editor the GIMP.
                                       Speakers include:Jason Rutherford - Track: Science  - Duration: 50 minutes - Audio/video needs: none ","EMC II",PUBLIC
"Introduction to Exoplanet Art with the GIMP 2",4/30/2016,19:00,4/30/2016,19:50,FALSE,"Missions like the Kepler telescope have shown our galaxy be home to countless exoplanets, but it is still up to artists to imagine how these planets.  Discover how easy it is for someone with no artistic experience to create beautiful exoplanet images with the open source editor the GIMP.
                                       Speakers include:Jason Rutherford - Track: Science  - Duration: 50 minutes - Audio/video needs: none ","EMC II",PUBLIC
"Kalidasia Fleet Commander - The Siege of Cadre 4",5/1/2016,14:00,5/1/2016,14:50,FALSE,"The Surakari have invaded Cadre 4 and it is up to a small Heragul fleet to hold the aliens at bay. Come defend Cadre 4(or destroy it!) in this two player asymmetrical game of planetary siege.  Speakers include:Jason Rutherford - Track: Gaming  - Duration: 50 minutes - Audio/video needs: none ","Lobby",PUBLIC
