Subject,Start Date,Start Time,End Date,End Time,All Day Event,Description,Location,Private
"What Have You Read?",4/30/2016,11:00,4/30/2016,11:50,FALSE,"What's something amazing that you read recently that you want to tell the world about?  Speakers include:Jim Leach, Andrea Johnson, Stewart Sternberg, Nicole Castle - Track: Literature  - Duration: 50 minutes - Audio/video needs: none ","Algonquin B/C",PUBLIC
"Editing for Your Spouse/Partner/BFF/Pet",4/29/2016,19:00,4/29/2016,19:50,FALSE,"'Can you read this and tell me what you think?' is a question to test any relationship.
 We will learn some ways to navigate that communications mine-field while musing on the nature of editing, the care and feeding of your larval writer and some small, practical steps towards upping our editing game.  Speakers include:Scott Favre, Clif Flynt, Janice Leach, Jim Leach - Track: Literature  - Duration: 50 minutes - Audio/video needs: none ","Hamlin",PUBLIC
"Poetry Starter Kit",4/29/2016,21:00,4/29/2016,21:50,FALSE,"Audience Participation Panel: Speculative Poetry Starter Kit: who to read, where to look and exactly what the heck IS speculative poetry.  Speakers include:Jim Leach, Sean Davis - Track: Literature  - Duration: 50 minutes - Audio/video needs: none ","EMC IV",PUBLIC
"Writing Fast and Slow",4/30/2016,16:00,4/30/2016,16:50,FALSE,"Are you a hack if you write quickly? Are you an amateur if you write slowly? How many books a year should a working writer produce, and how has that expectation changed in today’s publishing climate? How quickly do readers want—or expect—the next book?  Speakers include:Alex Kourvo, Jen Haeger, Jim Leach, Cathrynne Valente - Track: Literature  - Duration: 50 minutes - Audio/video needs: none ","Charlevoix C",PUBLIC
"Speak Your Words",4/30/2016,20:00,4/30/2016,20:50,FALSE,"We are all made of stories and sharing them can be powerful and life changing. Come and share our version of an open mic night.  Bring your self-written poetry, personal manifesto, or short-short story.  Speakers include:Jim Leach, Matt Betts, Sean Davis, Jessica Roland - Track: Literature  - Duration: 50 minutes - Audio/video needs: none ","EMC IV",PUBLIC
