Subject,Start Date,Start Time,End Date,End Time,All Day Event,Description,Location,Private
"Combat Mindset",4/24/2015,17:00,4/24/2015,18:50,FALSE,"Ever wonder what goes through the mind of a person when they're in a fight? What do they think about, and what are they doing when the fight starts? How does one prepare for a fight, any sort of fight? What does the phrase 'stay in the fight' mean? Come learn from a martial artist and veteran of Afghanistan and Iraq all about what goes on inside the brains and minds of people who find themselves in some sort of combat.  Speakers include:Kent Newland - Track: Action Adventure  - Duration: 1 hour and 50 minutes - Audio/video needs: none ","Algonquin A",PUBLIC
"Fighting and Rhythm",4/24/2015,19:00,4/24/2015,19:50,FALSE,"Learn how rhythm applies to fights and fighting, and how you can use or break that rhythm to throw your own brand of dirty tricks into the mix. Will cover hand, stick, knife, and sword.  Speakers include:Kent Newland - Track: Action Adventure  - Duration: 50 minutes - Audio/video needs: none ","Algonquin A",PUBLIC
"Beginner's Guide to Metalworking",4/25/2015,11:00,4/25/2015,11:50,FALSE,"Learn metalworking, welding theory and safety presented by two knowledgeable individuals whose combined experience totals 10+ years. Also, learn about why welding and blacksmithing is a useful tool to learn, and what you can do with different metals.  Speakers include:Kent Newland, Derek Newland - Track: DIY  - Duration: 50 minutes - Audio/video needs: none ","Board of Governors",PUBLIC
"Beginning Silat",4/25/2015,20:00,4/25/2015,20:50,FALSE,"Come learn about the Indonesian martial art of Silat. There are hundreds of different kinds of Silat, this will be a generic introduction to some of the throws and take-downs found in this lesser known martial art.  Speakers include:Kent Newland - Track: Action Adventure  - Duration: 50 minutes - Audio/video needs: none ","Algonquin A",PUBLIC
"Beginning Kali",4/25/2015,21:00,4/25/2015,21:50,FALSE,"Learn more about the Filipino Martial Art of Kali, as seen in the Bourne movies and The Book of Eli. Blocks, strikes, counterattacks, footwork and Filipino Martial Art theory will all be discussed and demonstrated.  Speakers include:Kent Newland - Track: Action Adventure  - Duration: 50 minutes - Audio/video needs: none ","Algonquin A",PUBLIC
