Subject,Start Date,Start Time,End Date,End Time,All Day Event,Description,Location,Private
"The Weird World Of Night Vale Presents",5/3/2019,17:00,5/3/2019,18:00,FALSE,"Nightvale Presents produces some of the most innovative speculative fiction podcast content available. With shows like Welcome to Night Vale, Alice Isn't Dead, Adventures in New America, and Within The Wires, its stable of shows are delightful dark, weird, incredibly queer, and extremely diverse. We'll discuss some of our favorite shows from Night Vale Presents, explore what sets them apart from more traditional SFF media, and discuss how they could serve as a model for a more inclusive SFF world.  Speakers include:Mari Brighe, Charlotte Wolf - Track: Media  - Duration: 1 hour ","Portage Auditorium",PUBLIC
"50 Minutes of Easy Research on LGBTQ People",5/3/2019,19:00,5/3/2019,20:00,FALSE,"Are you a writer/creator who wants to include LGBTQ people in your content? Have you already written queer and trans characters but want to make them deeper and more complex? Do you just have some really burning questions about something LGBTQ related that you just haven't felt comfortable asking? Well, here's your chance. Our panelists will answer your questions about pretty much anything (within reason, of course), and give you the easiest research you've done on a LGBTQ experiences.  Speakers include:Mari Brighe, Brigham Vaughn, Hank Edwards - Track: Life  - Duration: 1 hour ","Charlevoix B",PUBLIC
"Queer Theory for Everyone",5/4/2019,15:00,5/4/2019,16:00,FALSE,"Post-structural critical theory has been a hallmark of literary criticism in academia for years. However, Queer Theory and its related modes of inquiry like Critical Gender Theory, Critical Disability Theory, and Critical Race Theory, have been profoundly influential across disciplines from education to anthropology to technology studies. Come learn about the history and basic concepts of Queer Theory and how you can utilize it for better writing & editing, more socially-aware technology, and building more inclusive communities.  Speakers include:Mari Brighe, Charlotte Wolf - Track: Lit  - Duration: 1 hour ","Charlevoix A",PUBLIC
"Unwelcome: Unpacking the Backlash Against Marginalized Fans, Creators, and Content",5/4/2019,16:00,5/4/2019,17:00,FALSE,"A small, but increasingly virulent contingent of fandom has spent the last several years waging war against women, people of color, and LGBTQ people (and especially those at the intersections of those experiences) who desire to see themselves in genre media. From the Sad Puppies to Gamergate to Comicsgate, we'll talk through the reality of what creators and fans alike have experienced when under fire from these groups, the potential roots of this backlash, and what we can do as a community to push back against it. <br />  Speakers include:Mari Brighe - Track: Life  - Duration: 1 hour ","Charlevoix A",PUBLIC
"Surviving Social Media Visibility",5/5/2019,11:00,5/5/2019,12:00,FALSE,"Social media has provided many people the opportunity to make a name for themselves and build a following in ways that were never possible before. However, finding success and a platform comes with many downsides. Harassment, stalkers, hate mail, threats of violence, doxxing, and burnout are all common experiences for those with significant social media visibility. We'll discuss the best and worst of social media experiences, and how we learn to cope.  Speakers include:Mari Brighe, Brigham Vaughn - Track: Media  - Duration: 1 hour ","Portage Auditorium",PUBLIC
