Subject,Start Date,Start Time,End Date,End Time,All Day Event,Description,Location,Private
"Social Media for Writers",4/29/2016,18:00,4/29/2016,18:50,FALSE,"David Erik Nelson, Michael W. Lucas, Christopher Purrett, Alex Kourvo, Mark Oshiro, Mary Lynne Gibbs  Speakers include:David Erik Nelson, Michael W. Lucas, Christopher Purrett, Alex Kourvo, Mark Oshiro, Mary Lynne Gibbs - Track: Literature  - Duration: 50 minutes - Audio/video needs: none ","Hamlin",PUBLIC
"Screen Writing Tips",4/30/2016,11:00,4/30/2016,12:50,FALSE,"Aching to write a script for that great movie idea that's been bouncing around in your head? Come get some tips and tricks for how to get started on writing a script.  Speakers include:James Fernandez, Mary Lynne Gibbs, Dave Kilgore - Track: Media  - Duration: 1 hour and 50 minutes - Audio/video needs: none ","Charlevoix C",PUBLIC
"Character Problems - What's an Author to Do?",4/30/2016,15:00,4/29/2016,15:50,FALSE,"A main character needs to start out annoying, boring, or unappealing. (they have to grow from somewhere!) Your readers say 'ugh' and set your book aside. What's an author to do? How do we avoid this? Examples?  Speakers include:Mary Lynne Gibbs, Paul Kemner, Emmy Jackson, Cindy Spencer Pape, Jeff Pryor - Track: Literature  - Duration: 50 minutes - Audio/video needs: none ","Algonquin D",PUBLIC
"Finding an Agent",4/30/2016,16:00,4/30/2016,16:50,FALSE,"What are the best methods for finding the best agent for you?  Speakers include:Merrie Haskell, Ann Leckie, Mary Lynne Gibbs - Track: Literature  - Duration: 50 minutes - Audio/video needs: none ","Algonquin D",PUBLIC
"Reading/Signing: Jen Haeger and Mary Lynne Gibbs",4/30/2016,13:00,4/30/2016,13:50,FALSE,"Join our attending authors in the Writers Block (317 & 318) for reading and signing!  Speakers include:Jenn Haeger, Mary Lynne Gibbs - Track: Literature  - Duration: 50 minutes - Audio/video needs: none ","Writer's Block (313 & 315)",PUBLIC
