Subject,Start Date,Start Time,End Date,End Time,All Day Event,Description,Location,Private
"Social Media for Writers",4/29/2016,18:00,4/29/2016,18:50,FALSE,"What social media trends does a writer building their web footprint need to understand? What are some Dos and Don'ts?  Speakers include:David Erik Nelson, Michael W. Lucas, Christopher Purrett, Alex Kourvo, Mark Oshiro - Track: Literature  - Duration: 50 minutes - Audio/video needs: none ","Hamlin",PUBLIC
"PAM: You're Doing It Wrong",4/29/2016,20:00,4/29/2016,20:50,FALSE,"PAM, or Pluggable Authentication Modules, is one of the most occult parts of managing Unixish systems. The unique configuration syntax and idiosyncratic rule processing drives many sysadmins to copy working configurations from other people and random blog posts. This talk takes you through the essentials of PAM configuration, You'll learn the components of PAM, how PAM processes rules, how to use multi-factor authentication, and get an overview of some useful PAM modules you probably haven't used, based on my book 'PAM Mastery.'  Speakers include:Michael W. Lucas - Track: Tech  - Duration: 50 minutes - Audio/video needs: none ","Windover",PUBLIC
"The ZFS File System",4/29/2016,22:00,4/29/2016,22:50,FALSE,"ZFS, the Zettabyte File System, is one of the most full-featured filesystems available today and gives almost unlimited storage flexibility. Originally created by Sun Microsystems, the independent entity OpenZFS now develops ZFS as deployed in illumos, Linux, and FreeBSD.  This talk takes you through ZFS' features, including: data self-healing, deduplication and compression, clones and snapshots, copy-on-write, boot environments, replication, and more. Once you use ZFS, you'll never understand how you lived without it.  Speakers include:Michael W. Lucas - Track: Tech  - Duration: 50 minutes - Audio/video needs: none ","Windover",PUBLIC
"Networking for Systems Administrators",4/30/2016,11:00,4/30/2016,11:50,FALSE,"Too many organizations have a tense relationship between the network folks and the sysadmins. Sometimes it degenerates just short of war. But basic networking isn't hard--if it was, network engineers couldn't do it. This talk teaches the essentials, in a way that lets sysadmins troubleshoot network problems on their own. Sysadmins have amazing visibility into the network, once they know how to use it. We'll cover cross-platform tools for viewing and troubleshooting the network, on both Windows and Unix.  Speakers include:Michael W. Lucas - Track: Tech  - Duration: 50 minutes - Audio/video needs: none ","Windover",PUBLIC
"Encrypted Backups with Tarsnap",4/30/2016,16:00,4/30/2016,16:50,FALSE,"Online backup is incredibly useful, but has many privacy and integrity risks. Tarsnap is an online backup service that only handles your data in encrypted form. It's inexpensive and reliable. Plus you don't need to trust the Tarsnap service--they can't access your backups even if they want to. And Tarsnap's built-in deduplication saves space, letting you store terabytes of backups in mere gigabytes of disk. This talk takes you through using Tarsnap, from backing up a system to customizing and rotating backups, to fully restoring them.  Speakers include:Michael W. Lucas - Track: Tech  - Duration: 50 minutes - Audio/video needs: none ","Windover",PUBLIC
"Acts of Shameless Self-Promotion",4/30/2016,17:00,4/30/2016,17:50,FALSE,"What's the best way to get your name forward?  Speakers include:Dave Klecha, Michael W. Lucas, Jackie Morgan, Steven Saus - Track: Literature  - Duration: 50 minutes - Audio/video needs: none ","Portage",PUBLIC
"Self-Publishing 2016",5/1/2016,10:00,5/1/2016,10:50,FALSE,"This panel discusses today's self-publishing options and business models. Our panelists include authors who are both self- and traditionally published, in fiction and nonfiction, including people who are making an income entirely by self-publishing. We'll discuss why we made the choice to self-publish, the pitfalls and lessons learned, and which business choices we've made on our respective self-publishing efforts.  Speakers include:Michael W. Lucas, Jen Haeger, Christopher Purrett, Alex Kourvo, Robert Kroese - Track: Literature  - Duration: 50 minutes - Audio/video needs: none ","EMC I",PUBLIC
"BSD Operating Systems in 2016",5/1/2016,12:00,5/1/2016,12:50,FALSE,"The BSD family of Unix has a been kicking around for almost 40 years now, and have taken different paths than Linux. Come see the last year's developments in BSD land! One of them just might solve your intractable problem. We'll talk about new things from FreeBSD, OpenBSD, plus updates from NetBSD, Dragonfly, and assorted derivatives.  Speakers include:Michael W. Lucas - Track: Tech  - Duration: 50 minutes - Audio/video needs: none ","Windover",PUBLIC
"Senior Sysadmins Panel",5/1/2016,14:00,5/1/2016,14:50,FALSE,"Some say systems administration is a young man's game, and that eventually sysadmins rise into management. They're wrong.  A sysadmin who measures their experience in decades has made mistakes younger sysadmins can't even imagine. This panel lets you learn from their suffering, take advantage of their experience, and laugh at their pain.  Speakers include:Michael W. Lucas, Autumn Mahoney, John D. Bell - Track: Tech  - Duration: 50 minutes - Audio/video needs: none ","Windover",PUBLIC
