Subject,Start Date,Start Time,End Date,End Time,All Day Event,Description,Location,Private
"The NSA is Watching You: The Government, Surveillance, and You",5/3/2014,18:00,5/3/2014,18:50,FALSE,"Now that Edward Snowden has made you aware that the government is watching and recording your every move, come join our GoH Eva Galperin and Featured Guests Cory Doctorow and Nick Farr as they discuss of the implications of living in a surveillance state.   Speakers include:Eva Galperin, Cory Doctorow, Nick Farr - Track: Tech  - Duration: 50 minutes - Audio/video needs: Projector ","Algonquin D",PUBLIC
"Ridiculous Ideas in Space Travel",5/4/2014,11:00,5/4/2014,11:50,FALSE,"There are only three rules: Ridiculous, Plausible, Entertaining. All of our amazing panelists have agreed to present their ideas for Space Travel that fulfill each of these rules and are willing to suffer your silly and serious questions and comments on each. Come for the science, stay for the laughs!  Speakers include:Nick Farr, Eva Galperin, Jeff Goeke-Smith, Jolly - Track: Science  - Duration: 50 minutes - Audio/video needs: Projector ","Charlevoix C",PUBLIC
"The Biggest Game of Cards Against Humanity Ever Played",5/2/2014,22:00,5/3/2014,0:50,FALSE,"We're going to attempt the biggest game of Cards Against Humanity ever.  Even if you've only heard about this wild tabletop game, show up for the fun and stay for the chaos.  Speakers include:Nick Farr, M'jit Raindancer-Stahl, Dean Stahl - Track: Gaming  - Duration: 2 hours and 50 minutes - Audio/video needs: none ","Gaming (Restaurant)",PUBLIC
"Your Personal Penguicon with a Passport!",5/4/2014,13:00,5/4/2014,13:50,FALSE,"It's finally time: You need to visit Germany and Japan! Whatever your interest is, odds are you'll find a unique spin on it overseas that will change your life and how you view humanity. With nearly half a million transcontinental miles flown east and west, Nick Farr will regale you with tales of the geekiest highlights in both countries and tips on how to have an authentic, safe, geeky and budget-conscious international trip to Germany and Japan.  Speakers include:Nick Farr - Track: Life  - Duration: 50 minutes - Audio/video needs: Projector ","Montcalm",PUBLIC
"Bitcoin, Dogecoin, and Cryptocurrencies… What’s the Big Deal?",5/3/2014,19:00,5/3/2014,19:50,FALSE,"What's a cryptocurrency and why do we need it? What is Bitcoin mining? Why is Bitcoin so volatile? What is this scary new money and why is it important in our ever-changing world?  Speakers include:YTCracker, Nick Farr - Track: Tech  - Duration: 50 minutes - Audio/video needs: none ","Windover",PUBLIC
