Subject,Start Date,Start Time,End Date,End Time,All Day Event,Description,Location,Private
"Opening Ceremonies",4/29/2016,18:00,4/29/2016,18:50,FALSE,"Join our con chair, Scott Kennedy, the Con Committee, and our Guests of Honor as we open this bad boy up for the weekend.  You never know what surprises might be in store!  Speakers include:Scott Kennedy, Daniel Dugan, Nuri Gocay, Cylithria Dubois, Amanda Long-Adams, Amanda Robinson, Miranda Webster, Jessica Roland, Julie,Winningham, Ann Lemay, Ann Leckie, Cathrynne Valente, Deb Nicholson, Jason Mars, Lingjia Tang - Track: Penguicon  - Duration: 50 minutes - Audio/video needs: none ","Algonquin B/C",PUBLIC
"Flirting for Geeks",4/29/2016,22:00,4/29/2016,22:50,FALSE,"Come learn how (and how not) to flirt from some of our local fandom's biggest flirts. Not only is it laugh-out-loud funny, it's an irreverent and honest reflection of love, sex, and fandom. Find ways to woo, methods for making friends, and how to have a good time without making others uncomfortable.  Speakers include:Nuri Gocay, Bob Waltenspiel, Dave Phillips, Scott Kennedy, Marie Staver, Jessica Roland, Mark Oshiro - Track: Life  - Duration: 50 minutes - Audio/video needs: none ","Charlevoix A",PUBLIC
"Intro to Podcasting",4/30/2016,11:00,4/30/2016,11:50,FALSE,"All the cool kids are doing it...and more importantly, even more of the not so cool kids are doing it - podcasting. So what do you need to know to get started? Go live or record and syndicate only? What kind of mics? What should you know before getting started? In your basement or a studio somewhere? Learn from local podcasters with lots of experience and known throughout the podcasting community.   Speakers include:Dave Phillips, Bob Waltenspiel, Nuri Gocay, Karen Hubbard, Shannon Marshall, Maggie Maiville, Jonathan Hickey, Scott Markwart - Track: Media  - Duration: 50 minutes - Audio/video needs: none ","Charlevoix B",PUBLIC
"Social Media Entertainers Collide",4/30/2016,14:00,4/30/2016,14:50,FALSE,"Entertainers from different aspects of social media (YouTube, Podcasting, Music, Public Television, and others) discuss aspects of working on-line and sharing their experiences.   Speakers include:Kass Lawrence, Crazy Mark, Dave Phillips, Bob Waltenspiel, Nuri Gocay, Karen Hubbard, Scott (Toaden) Maiale, BluRaven C. Houvener, Trooper Isomorph, Trooper Mindtrick - Track: Media  - Duration: 50 minutes - Audio/video needs: none ","Charlevoix C",PUBLIC
"Penguicon 2017 Planning Meeting",5/1/2016,11:00,5/1/2016,11:50,FALSE,"Making a successful Penguicon requires at least a year of organizing, planning, and partying.  Do not skip the partying!  Join us for the first planning meeting with the 2017 ConChair, Cylithria DuBois, and her selected Con Committee. If you want to contribute to Penguicon next year, or you just want to see how we make it happen, join us!  Speakers include:Scott Kennedy, Daniel Dugan, Nuri Gocay, Cylithria Dubois, Amanda Long-Adams, Amanda Robinson, Miranda Webster, Jessica Roland, Julie,Winningham - Track: Penguicon  - Duration: 50 minutes - Audio/video needs: none ","Hamlin",PUBLIC
"Closing Ceremonies",5/1/2016,16:00,5/1/2016,16:50,FALSE,"As we officially shut down another amazing, exciting year for Penguicon, come hear about how it went, and what we've got our eye on for next year.  Speakers include:Scott Kennedy, Daniel Dugan, Nuri Gocay, Cylithria Dubois, Amanda Long-Adams, Amanda Robinson, Miranda Webster, Jessica Roland, Julie Winningham, Ann Lemay, Ann Leckie, Cathrynne Valente, Deb Nicholson, Jason Mars, Lingjia Tang - Track: Penguicon  - Duration: 50 minutes - Audio/video needs: none ","Algonquin B/C",PUBLIC
