Subject,Start Date,Start Time,End Date,End Time,All Day Event,Description,Location,Private
"Anime Fantasy-Romance",5/3/2019,19:00,5/3/2019,20:00,FALSE,"Anime romance is in the air! Wait, there's magic too? Let's look at clips and explore some of the best shows in this genre, leaving lackluster 'notice me sempai' far behind.  Speakers include:Paul Kemner, Star Stramel, Natasha Kidwell - Track: Anime  - Duration: 1 hour ","EMC V",PUBLIC
"Anime Director Spotlight: Satoshi Kon",5/3/2019,20:00,5/3/2019,21:00,FALSE,"Kon wrote and directed four movies and a TV series before his tragic death. His highly-acclaimed work has been described as 'gritty, intense, and at times even nightmarish,' with themes of obsession and illusion vs reality. We'll check them out, discussing themes, styles, and what makes them worth watching, ending with an open discussion.  Speakers include:Paul Kemner - Track: Anime  - Duration: 1 hour ","EMC V",PUBLIC
"Super-Violent Anime that is Totally Worth Your Time (Trust Us!)",5/3/2019,22:00,5/3/2019,23:00,FALSE,"Anime can seem shockingly violent to people who think 'cartoons' are for children, but anime is created for adults too. But what to watch? Our bloodthirsty fan crew will share their favorites, with an emphasis on gripping stories and intriguing themes.  Speakers include:Cassy Sinke, Paul Kemner - Track: Anime  - Duration: 1 hour ","Charlevoix B",PUBLIC
"Supernatural Anime: The Creepy, the Scary, and the Fun",5/4/2019,12:00,5/4/2019,13:00,FALSE,"Japan has the widest and weirdest menagerie of supernatural beasties and ghosts, and they haunt the world of anime too! With influences from Shinto and Buddhism, folk tales, and urban legends, you're never quite sure what will happen next. We'll geek out on our picks of what's worth watching and why.  Speakers include:Paul Kemner, Star Stramel, A. Carina Spears - Track: Anime  - Duration: 1 hour ","EMC IV",PUBLIC
"Five-Minute Anime: Face-Off",5/4/2019,14:00,5/4/2019,15:00,FALSE,"Tiny anime jewels: these series are silly, senseless, bizarre, or creepy, with episodes only five minutes long! We'll show our favorites, and you'll pick Penguicon's Best for 2019!  Speakers include:Paul Kemner, Star Stramel, A. Carina Spears - Track: Anime  - Duration: 1 hour ","EMC III",PUBLIC
"Black Butler AMV Tea Party",5/4/2019,19:00,5/4/2019,21:00,FALSE,"Reapers work hard and party harder! Come join Ronald Knox, Abberline, Ankou D Undertaker, and William T. Spears as they light up the night as only grim reapers can! Sample a bevy of non-alcoholic drinks. Enjoy Japanese snacks and mingle as we watch videos, run a few games like the best Tsundere turn-away, and dance the night away.  Speakers include:Paul Kemner, Star Stramel, Natasha Kidwell, Angela C. Spears - Track: Anime  - Duration: 2 hours ","Food [317]",PUBLIC
"Lizzy's Garden Party",5/5/2019,13:00,5/5/2019,15:00,FALSE,"The reapers of Black Butler cordially invite you to join us for an elegant midday tea. Come and learn about the finer points of the Victorian era, from the arts of etiquette and parasol dueling to the languages of fans and flowers. By the end, you will be able to charm most anyone! Limited seating, formal dress is welcome, please sign up in advance at Ops!  Speakers include:Paul Kemner, Star Stramel, Natasha Kidwell, Angela C. Spears - Track: Anime  - Duration: 2 hours ","Food Room [317]",PUBLIC
