Subject,Start Date,Start Time,End Date,End Time,All Day Event,Description,Location,Private
"Intro to OpenBSD",4/30/2016,10:00,4/30/2016,10:50,FALSE,"OpenBSD is a variety of Unix that is similar to Linux, but with perhaps a stronger security focus. It is a project run by volunteers, and is a free software program. Come and learn more about this alternative operating system.  Speakers include:STeve Andre', Marcus Watts","Montcalm",PUBLIC
"Intro to Zenoss",4/30/2016,10:00,4/30/2016,10:50,FALSE,"An Introduction to Network Monitoring utilizing the Open Source Zenoss Monitoring System.  Topics covered will include configuration, managing monitored hosts via SNMP, SSH, and basic remediation.  Speakers include:Andrew D Kirch","Nicolet",PUBLIC
"LSDj n' U! A How-To Track and Perform Live with Chiptunes!",4/30/2016,10:00,4/30/2016,10:50,FALSE,"Have you ever been curious to know how chip artists compose music on a classic Nintendo Gameboy? Or even been more curious on how they tweak their tunes during a live performance? Snesei, Dollfin, and McGRANAMAN will not only show you the basics of LSDj and various tips and tricks of the program, but they'll also give insights on how to manipulate the pre-tracked song for live performances. At the end, audience members are invited to try LSDj's LIVE mode to create their own, unique Gameboy tune.  Speakers include:Jacob Dean McGranaghan, Corey Chappell, Garrett Boone","Portage",PUBLIC
"First Things First: Story Titles ",4/30/2016,10:00,4/30/2016,10:50,FALSE,"First Things First: Story Titles: Which comes first, a story or its title? What makes a good title? Who gets to decide what that title would be? Should a title hint at the story to come, or only make sense after the story is read?   Speakers include:Jon David, Alex Kourvo, Christine Daigle, Michael Cieslak","Windover",PUBLIC
"The Future of Biohacking",4/30/2016,11:00,4/30/2016,11:50,FALSE,"Three of our Featured Guests look into the future to discuss how we could incorporate new technology into our bodies, and what the benefits can be for us as individuals and as communities.  Speakers include:Amal Graafstra, Anita Fowler, Greg Gage","Algonquin B/C",PUBLIC
"Overthrow the Trichromatocracy: Making Color-blind Friendly UIs",4/30/2016,11:00,4/30/2016,11:50,FALSE,"Think your snazzy new UI is fantastic? Did you test it with color-blind users? No? Then you're probably in for a surprise for how much information you are trying to convey in a way that is not accessible to your users who have colorblindness or color sight deficiencies. We will discuss the details of what it means to be color blind and what you can do as a programmer or designer to improve the usability of your software for the 1 in 12 of your users who are color blind.  Speakers include:Scott Favre","Algonquin D",PUBLIC
"Fedora Roadmap",4/30/2016,11:00,4/30/2016,11:50,FALSE,"Take a look at one of the premiere Linux distributions which serves as the testing ground for Red Hat Linux.  Speakers include:Tom Callaway","Charlevoix A",PUBLIC
"Intro to Podcasting",4/30/2016,11:00,4/30/2016,11:50,FALSE,"All the cool kids are doing it...and more importantly, even more of the not so cool kids are doing it - podcasting. So what do you need to know to get started? Go live or record and syndicate only? What kind of mics? What should you know before getting started? In your basement or a studio somewhere? Learn from local podcasters with lots of experience and known throughout the podcasting community.   Speakers include:Dave Phillips, Bob Waltenspiel, Nuri Gocay, Karen Hubbard, Shannon Marshall, Maggie Maiville, Jonathan Hickey, Scott Markwart","Charlevoix B",PUBLIC
"Screen Writing Tips",4/30/2016,11:00,4/30/2016,12:50,FALSE,"Aching to write a script for that great movie idea that's been bouncing around in your head? Come get some tips and tricks for how to get started on writing a script.  Speakers include:James Fernandez, Mary Lynn Gibbs, Dave Kilgore","Charlevoix C",PUBLIC
"BoF: Deployment and Testing",4/30/2016,11:00,4/30/2016,11:50,FALSE,"Come share your experiences in deploying and testing software.  Birds of a Feather events are unmoderated.  Speakers include:Mark Henke","EMC I",PUBLIC
"Silicone Casting for Cheap Bastards",4/30/2016,11:00,4/30/2016,11:50,FALSE,"Ever wanted to make things out of silicone but don't want to spend a bunch of money? Learn how to cast things out of inexpensive silicone caulk and corn starch.   Speakers include:Gnora Ford-Lepthien","EMC II",PUBLIC
"Keysigning Party",4/30/2016,11:00,4/30/2016,13:50,FALSE,"In this hands-on event, participants will learn how the web of trust model works and perform identity verification with fellow attendees. We will do so in a manner compatible with CAcert.org, so you can use the resulting identify assurance to issue your own free SSL certificates, code signatures, etc. With a little additional work, you can also become an assurer of your own right at Penguicon. We will also exchange OpenPGP keys if you have them, so bring your key fingerprints with you! Participants need to bring at least two forms of ID — at least one of which must be a government issued photo ID showing birthdate. Having your own notebook computer able to output PDFs files greatly simplifies things, too. New users are expected to show up at the start, but returning participants from Penguicon Keysigning events and any CAcert.org assurers may show up one hour in.  Speakers include:Richard Houser","EMC IV",PUBLIC
"Knitting 101",4/30/2016,11:00,4/30/2016,12:50,FALSE,"Learn how to use two sticks and a piece of string to make works of art!  A pair of needles and yarn will be provided or you can bring your own so you can learn to make things like dishcloths and scarves. This is a limited attendance event.  Please sign up at Ops.  Speakers include:Kelly Vanderwell","EMC V",PUBLIC
"Homebrewing",4/30/2016,11:00,4/30/2016,12:50,FALSE,"There are many wonderful beverages that can be made at home. This presentation will cover Beer Making, Cider Making, Wine Making and Mead Making with a break down of all the equipment needed to accomplish the end goal.  Speakers include:Johnathon A. Campbell","1017",PUBLIC
"Hands on Soldering and Embedded Programming with All Hands Active",4/30/2016,11:00,4/30/2016,11:50,FALSE,"Get Hands-on with a Penguicon Tradition. All Hands Active members will have kits for sale to solder and program the latest iteration of their Penguicon upgraded badges.   Speakers include:All Hands Active","HackerSpace (317)",PUBLIC
"Flash Comics!",4/30/2016,11:00,4/30/2016,11:50,FALSE,"No we're not talking about the fastest man alive, we're talking about the wild new form of comics that incorporate the technology of today! These comics keep you on the edge of your seat and pull you in even deeper with stunning animations interwoven into the frames! Just when you thought you knew comics!  Speakers include:Noa Page","Hamlin",PUBLIC
"The Return of Mary Sue",4/30/2016,11:00,4/30/2016,11:50,FALSE,"The concept of the Mary Sue is back with the criticisms of Star Wars Episode VII's Rey as an unrealistic hero. How does this critique of female characters impact our perceptions of competent women?  Why do men get unrealistic idealized male characters as heroes as the norm in SFF media, but female characters with the same traits are ridiculed?   Speakers include:Ann Lemay, Ann Leckie, Merrie Haskell","Montcalm",PUBLIC
"Beginning Your Home Music Studio",4/30/2016,11:00,4/30/2016,11:50,FALSE,"Filker Tom Smith talks about how to start your own home music studio.  Speakers include:Tom Smith","Nicolet",PUBLIC
"DIY Electric Car Edition",4/30/2016,11:00,4/30/2016,12:50,FALSE,"Come learn about the The Avenger GT-EV an Electric Vehicle build by our featured guest Chad Sinke from SCRATCH.  He'll talk about why he did it, how he did it, and how you can build your own car too!  If you're interested in Electric Vehicles, Engineering, or just awesome DIY projects this is a panel you won't want to miss!  Speakers include:Chad Sinke","Portage",PUBLIC
"Networking for Systems Administrators",4/30/2016,11:00,4/30/2016,11:50,FALSE,"Too many organizations have a tense relationship between the network folks and the sysadmins. Sometimes it degenerates just short of war. But basic networking isn't hard--if it was, network engineers couldn't do it. This talk teaches the essentials, in a way that lets sysadmins troubleshoot network problems on their own. Sysadmins have amazing visibility into the network, once they know how to use it. We'll cover cross-platform tools for viewing and troubleshooting the network, on both Windows and Unix.  Speakers include:Michael W. Lucas","Windover",PUBLIC
"Legendary Encounters",4/30/2016,11:00,4/30/2016,13:50,FALSE,"2-5 players. A deck-building game where players must cooperate in order to survive against hordes of aliens.  Speakers include:Jason Sonk","Game Table G",DEFAULT
"Build Your Own Router",4/30/2016,12:00,4/30/2016,12:50,FALSE,"Yes, you could just go to the store and buy a router, but where is the coolness in that? Making your own out of a spare computer or an inexpensive Raspberry Pi gives you major geek cred points. In today's world, with the FCC asking manufacturers to limit access to router firmware, knowing how to make your own is more important than ever. Our panel will share tips and tricks to help you conquer this and get your merit badge!  Speakers include:Steven Ostrowski, Tom Lawrence, Britain Woodman","Algonquin B/C",PUBLIC
"The Reality and Fiction of Artificial Intelligence",4/30/2016,12:00,4/30/2016,12:50,FALSE,"Artificial intelligences have been a staple of science fiction forever.  But where does the reality of AI end, and the fiction begin?    Speakers include:Ann Leckie, Jason Mars, Lingjia Tang, Jennifer Marsman","Algonquin D",PUBLIC
"Retrogaming",4/30/2016,12:00,4/30/2016,17:50,FALSE,"Join us for Retro Gaming! Including systems from Atari to Game Cube and (almost) everything in between, join us for four hours of reliving your childhood! Enter our Mario Party 4 Tournament and win a retro system to take home!  Speakers include:Angie Rush","Baldwin",PUBLIC
"Women Making Comics in Detroit",4/30/2016,12:00,4/30/2016,12:50,FALSE,"The creators of Sidekick Girls and the conchair and planning committee head of ComiqueCon discuss what it's like to be a woman creating comics and the comics community in Southeast Michigan.  Speakers include:Erika Wagner, Laura Cascos, Chelsea Liddy, Sharon Vinson, Elizabeth 'Biz' Nidjam","Charlevoix A",PUBLIC
"The Cars Aren't Flying, But They Are Driving Themselves",4/30/2016,12:00,4/30/2016,12:50,FALSE,"We're extremely close to having fully autonomous vehicles available for sale, and what does that mean for the average consumer?  We hear a lot about Google and Apple's efforts, but Ford, Volvo, Mercedes, Nissan, Toyota/Lexus and Audi are all in this game up to their elbows as well.  Which of them is likely to get to the market first?  Who are self-driving cars going to be marketed to?  What's the state of the technology?  Is this a technological revolution, or a tempest in a teacup?  And are they going to take over the world and kill us all?   Speakers include:Emmy Jackson, Krunal Desai","Charlevoix B",PUBLIC
"Open Linux Computer Lab (Unconference)",4/30/2016,12:00,4/30/2016,13:50,FALSE,"Open Computer lab utilizing the Unconference philosophy of Open Space Technology. Bring your projects to discuss. Bring your discussions to projects. Attendees may also peruse social media, tweet to #Penguicon, browse the whole internet and get a feel for Linux using one of our 20 laptops.  Speakers include:No Presenter","Computer Lab (EMC III)",PUBLIC
"Evoking Emotions, Provoking Readers",4/30/2016,12:00,4/30/2016,12:50,FALSE,"Creating authentic characters who seem to experience a full range of believable emotions is only half the equation in character-building.  How can we use character emotions to evoke real feelings in our readers? What other tricks are there?  Speakers include:Merrie Haskell, Cindy Spencer Pape, Ken MacGregor, Cathrynne Valente","EMC I",PUBLIC
"Poly and Kids",4/30/2016,12:00,4/30/2016,12:50,FALSE,"An open discussion about the challenges, the joys and the judgement of raising kids in a poly environment.    Speakers include:Jen Schwartz, Matt Sweet, Max Issac","EMC II",PUBLIC
"i3 Vinyl Tshirts",4/30/2016,12:00,4/30/2016,13:50,FALSE,"i3's Vinyl cutter and Heat Press (shirt press & Mug Press) is coming to Penguicon's Hackerspace!Transfer from a image to sticker, from a sticker to a awesome decoration in your shirt or mug! i3 will also demonstrate the basic functions in our new software “Sure Cuts A Lot”. It’s straightforward and interesting!   Speakers include:Yajie Wang","HackerSpace (317)",PUBLIC
"Emulators and Emulation",4/30/2016,12:00,4/30/2016,12:50,FALSE,"Emulating a trip through Craig's childhood, one machine at a time. Desktop computers today don't have any soul. Sure you have your Linux and your Macintosh and your 'Windows' but it's all pretty much the same hardware underneath. Why not put those gigahertz to use and emulate the hardware and software of yester-year? Craig Maloney will give a tour of his childhood by showing us how to (legally) run such computers as the Atari 800XL, the Commodore Amiga, PET and C64, the Sinclair ZX series, and even some arcade games. Amaze your friends by running a room-full of 1970s and 1980s technology on more capable hardware. It's a presentation you won't want to miss!  Speakers include:Craig Maloney","Hamlin",PUBLIC
"Intro to Python",4/30/2016,12:00,4/30/2016,12:50,FALSE,"Python is one of the most used programming languages on the Web, so come and get your feet wet with this tool, then stay for the Python Code Walk-Through that follows  Speakers include:Mike Bernson","Montcalm",PUBLIC
"The Heroines of Anime ",4/30/2016,12:00,4/30/2016,12:50,FALSE,"Join our panelists for a discussion of their favorite anime heroines, from Riza to Major Motoko.  Speakers include:Maria Dugan, Cassy Sinke","Nicolet",PUBLIC
"Solar Observing",4/30/2016,12:00,4/30/2016,12:50,FALSE,"ReRoot Pontiac, a newly founded non-profit located in Pontiac, MI would like to share its mission. We are a group of students, scientists,  gardeners and entrepreneurs focused on developing interest in science, technology, engineering and mathematics. To achieve this we are designing and building interactive spaces containing examples of sustainable energies and natural systems to promote experiential learning.  Speakers include:Bob Trembley","Outside",PUBLIC
"Technology in Education",4/30/2016,12:00,4/30/2016,12:50,FALSE,"Technology offers many new possibilities for education, including the flipped classroom and the ability to design more adaptable tests, so that students are assessed on questions appropriate to their ability levels. What are the various ways that technology and computer advancements can improve education?  Speakers include:Andrew Zimmerman Jones","Windover",PUBLIC
"Walk the Solar System",4/30/2016,12:00,4/30/2016,12:50,FALSE,"Stretched down a long hall of the hotel is a scale-model of the solar system! At the position of the Sun and orbits of the planets, you will find a poster(with a QR code) with more information on that body.  Speakers include:","",PUBLIC
"Warlords of the 6 Kingdoms",4/30/2016,12:00,4/30/2016,12:50,FALSE,"2-6 players. There can only be one! Take the role of a raucous, power-hungry warlord who’s off to conquer the 6 kingdoms! Select one city at a time, and send a champion to win it using the savory influence of fear, bribes, or pure military strength. If multiple warlords have sent a champion, the one with the highest of the three influences will be victorious. But simply approaching a city won't cut it: hazards and defenses must be navigated, or your champion won't even get close!  Speakers include:Nikolas Smart","Game Table A",DEFAULT
"Authentic Pirate Games",4/30/2016,12:00,4/30/2016,12:50,FALSE,"Learn several card games and board games from the late 17th and early 18th centuries.  Speakers include:Rathbone The Pirate","Game Table B",DEFAULT
"Abyss",4/30/2016,12:00,4/30/2016,12:50,FALSE,"2-4 players. Use all of your cunning to win or buy votes in the Council. Recruit the most influential Lords and abuse their powers to take control of the most strategic territories.  Speakers include:Steve Benson","Game Table E",DEFAULT
"Ki Qigong",4/30/2016,13:00,4/30/2016,13:50,FALSE,"In Chinese, Qi means “Energy or Air” and gong means “work or refinement”. Put together “Qigong” is the most generic term for working with and refining human energy. Ki is the Japanese pronunciation of Qi. The character Ki is found in both AiKido and ReiKi. Common applications of Qigong are Martial Arts and Healing. In China, Traditional Chinese Medicine, of which Qigong is a part, is a $25 Billion business. Ki Qigong pulls from a breadth of different types of Chinese and Japanese qigong, hypnosis, imagery, and other human energy modalities, as well as from new biological and physics models.  Speakers include:Dr. Justin Coven","Algonquin A",PUBLIC
"Bringing Sci-Fi into the Everyday: Augmented reality in a Children's Hospital",4/30/2016,13:00,4/30/2016,13:50,FALSE,"Featured Guest Christina York tells us about one company's mission to put augmented reality (AR) technology to good use, highlighting some inspirational sci-fi moments and then describe how they are taking AR out of the movies and creating moments of wonder and joy for kids in hospital.   Speakers include:Christina York","Algonquin B/C",PUBLIC
"A Writer's Life",4/30/2016,13:00,4/30/2016,13:50,FALSE,"How do you handle the daily mechanics of hammering your magical, sparking, glittering craft into the finished product that could sell. What practical habits foster the creative process on a daily basis and how do you manage the emotional blender that is making words ready for publishing?   Speakers include:Tobias Buckell, Ferrett Steinmetz, Cathrynne Valente, Dave Klecha, Andrew Zimmerman Jones","Algonquin D",PUBLIC
"Freenet: A Social Approach to Privacy",4/30/2016,13:00,4/30/2016,13:50,FALSE,"In this talk, we will introduce Freenet, the anonymous peer-to-peer publication platform. We will talk about the features and benefits that Freenet currently provides, compare to existing tools such as Tor and I2P and discuss Freenet's novel approach to networking.  Speakers include:Michael Grube, Steve Dougherty","Charlevoix A",PUBLIC
"A Truth Universally Acknowledged: Swift Design Patterns As Jane Austen Heroes",4/30/2016,13:00,4/30/2016,13:50,FALSE,"Have you ever looked at your code and realized that a certain design pattern was charging in like a romantic hero, sweeping away the confusion and bringing order to chaos? Or perhaps you've encountered a pattern that you utterly hated...until it's virtues slowly grew on you as you realized that the alternative was a complete disaster? Let's imagine Ada Lovelace reading Jane Austen, and compare some of my favorite design patterns with some of my favorite Jane Austen heroes (neither knowledge of Swift nor Jane Austen are required).  Speakers include:Anne Cahalan","Charlevoix B",PUBLIC
"Finding the Right Social Media",4/30/2016,13:00,4/30/2016,13:50,FALSE,"Finding the right social media platform to build your business is tricky. Should you use Facebook, Youtube, Twitter, Instagram, the list goes on and on. This panel will explore what options that can work for you.  Speakers include:Kass Lawrence","Charlevoix C",PUBLIC
"Crocheting 101",4/30/2016,13:00,4/30/2016,13:50,FALSE,"Come learn how to crochet!  Bring your yarn and hooks (or some of your stash to help start out new people!). Everyone is welcome to discuss different techniques and stitches. Come learn some new skills or help to teach others new skills.  Speakers include:Shetan Noir","EMC I",PUBLIC
"Creature Costumes",4/30/2016,13:00,4/30/2016,13:50,FALSE,"Learn various techniques to create non-human scifi/fantasy costumes. From scaly to fuzzy, find out how to create a werewolf, lizardman, fishman, insect, and more!  Speakers include:Gnora Ford-Lepthien","EMC II",PUBLIC
"Penguicon Board Meeting",4/30/2016,13:00,4/30/2016,14:50,FALSE,"You've done the convention, you've met the staff, and you've even socialized with the ConCom.  But what about those *other* Penguicon people?  Those shadowy figures that create the multi-year rules, have their fingers on the money, and cause a ConChair to mysteriously appear every year in a puff of penguin-scented smoke?  Ever wonder what the Penguicon Board of Directors does in their secret sanctum, and where they are taking Penguicon?  Come to the Board of Directors meeting and see!  Speakers include:Steve Gutterman, Randy Bradakis, Matt Arnold, Jer Lance, Gini Judd","EMC V",PUBLIC
"Kitchen Hacks 101",4/30/2016,13:00,4/1/2016,13:50,FALSE,"An incomplete and tangential discussion about tricks to save time, money, and energy in the kitchen. 
  Speakers include:Emily Tuesday","1017",PUBLIC
"Intro to Agile/Scrum",4/30/2016,13:00,4/30/2016,14:50,FALSE,"What does it mean to be Agile?  Is it all marketing and hype or does this represent the future of software development?  We will explore fundamentals of Agile software development and focus primarily on the SCRUM framework.  We will discuss things like the element of Scrum, it’s roles, cadence and traditions, the elements of a good User Story,how to write an Acceptance Criteria, how to estimate User Stories using Scrum-Poker, release planning, a few useful Metrics, and follow-up with a few closing thoughts.
  Speakers include:Donald Mark Haynes, Douglas Johnson","Hamlin",PUBLIC
"Q&A With Ann Lemay",4/30/2016,13:00,4/30/2016,13:50,FALSE,"Join Guest of Honor Ann Lemay for a Q&A on writing narratives for video games like Bioshock and Mass Effect.  Speakers include:Ann Lemay","Montcalm",PUBLIC
"'Pieces of Eight' Live from Penguicon!",4/30/2016,13:00,4/30/2016,13:50,FALSE,"This live recording of Rathbone the Pirate's 'Pieces of Eight' webcast will give attendees a chance to have their pirate questions answered. Special guest: Mitch 'Duckman' Peters  Speakers include:Rathbone the Pirate, Mitch 'Duckman' Peters","Nicolet",PUBLIC
"RPG: Roleplay Podcast Game",4/30/2016,13:00,4/30/2016,13:50,FALSE,"Some of the best improv I've ever been part of has been around a gaming table.  We're going to set up recording gear and then run a short gaming session.  The recording will be edited into a radio play that will be made available online right after the con. We'll be using a system that doesn't require any previous knowledge to play. All you need to bring is your willingness to get into character!  Speakers include:Jody Raiford","Podcast Suite",PUBLIC
"Tom Smith Concert",4/30/2016,13:00,4/30/2016,13:50,FALSE,"Apparent Nifty Guest In Perpetuity Tom Smith is back, with new songs, a new album (a kids' album! Must be the apocalypse), and the usual assortment of catchy tunes and lousy puns.  Speakers include:Tom Smith","Portage",PUBLIC
"Security Principles for Programmers",4/30/2016,13:00,4/30/2016,13:50,FALSE,"A Senior Systems Analyst from the Center for Applied Cybersecurity Research will present a few basic information security principles and demonstrate how to apply them to programming of any kind.  Make your code less exploitable.  Speakers include:Susan Sons","Windover",PUBLIC
"Warlords of the 6 Kingdoms",4/30/2016,13:00,4/30/2016,13:50,FALSE,"2-6 players. There can only be one! Take the role of a raucous, power-hungry warlord who’s off to conquer the 6 kingdoms! Select one city at a time, and send a champion to win it using the savory influence of fear, bribes, or pure military strength. If multiple warlords have sent a champion, the one with the highest of the three influences will be victorious. But simply approaching a city won't cut it: hazards and defenses must be navigated, or your champion won't even get close!  Speakers include:Nikolas Smart","Game Table A",DEFAULT
"Lords of Waterdeep",4/30/2016,13:00,4/30/2016,14:50,FALSE,"2-6 players. Includes Skullport expansion. A worker placement style game with a D&D theme. Rules are quick to learn but it still has depth.  Speakers include:Timothy Brown","Game Table B",DEFAULT
"Intro to Android: Netrunner Card Game",4/30/2016,13:00,4/30/2016,16:50,FALSE,"Max 8 players (ages 13+). Beginners encouraged to attend. Learn how to play this Living Customizable Card Game for two players, set in the cyberpunk future of 'Android' and 'Infiltration'! One player is a megacorporation and the other is a runner. Corporations must secure their servers and data forts with security programs. Runners need to spend their time and credits developing sufficiently powerful wealth, hardware, and software to hack past corporate security measures. They risk having their best programs trashed or captured by a trace program and left vulnerable to corporate countermeasures, or suffer massive brain damage from a failed intrusion attempt.  Speakers include:Eric McGlohon, Bryan Snell","Game Table C",DEFAULT
"Kingsburg",4/30/2016,13:00,4/30/2016,14:50,FALSE,"2-5 players. In Kingsburg, players are Lords sent from the King to administer frontier territories. The game takes place over five years, a total of 20 turns. In every year, there are 3 production seasons for collecting resources, building structures, and training troops. Every fourth turn is the winter, in which all the players must fight an invading army. Each player must face the invaders, so this is not a cooperative game.  Speakers include:Steve Benson","Game Table E",DEFAULT
"Codenames",4/30/2016,13:00,4/30/2016,13:50,FALSE,"2-8 players. Two teams go head to head as their spy masters attempt to give them one word clues to find their own agents the fastest.  Speakers include:Jason Sonk","Game Table G",DEFAULT
