Subject,Start Date,Start Time,End Date,End Time,All Day Event,Description,Location,Private
"FRAG",5/2/2014,16:00,5/2/2014,17:50,FALSE,"Frag is a computer game without a computer. It's a 'first-person shooter' on a tabletop. Move your fighter and frag your foes; draw cards for weapons, armor, and gadgets; move through the blood spatters to restore your own health! If you die, you respawn and come back shooting! Up to six can play.  Speakers include:","Gaming (Restaurant)",PUBLIC
"Nuns on the Run",5/2/2014,16:00,5/2/2014,17:50,FALSE,"In Nuns on the Run™ you explore the exciting nocturnal world of a grand abbey filled with intrigue and deception. As the old abbess, the noble prioress, or a simple novice you become hunter or prey. Everyone gets a special 'blessing' but only the novices try to fulfill a 'secret wish.' They must sneak through the dimly lit halls, corridors, and gardens, seeking keys and treasures unique to their goal. Meanwhile, the vigilant abbess and prioress patrol their routes, ever watchful of young novices who should be fast asleep in their austere cells. Are you wily enough to fulfill your quest and win the night?  Speakers include:","Gaming (Restaurant)",PUBLIC
"MidEvil Deluxe",5/2/2014,18:00,5/2/2014,19:50,FALSE,"MidEvil is the first game to be based on, and an extension of, the award winning Zombies!!! system from Twilight Creations. Players have escaped the modern-day zombie horde only to find themselves transported back in time and faced with a whole new set of problems!  Speakers include:","Gaming (Restaurant)",PUBLIC
"Murder of Crows",5/2/2014,18:00,5/2/2014,19:50,FALSE,"Uncover a murder most foul by revealing six story elements that together describe the deadly deed and spell the word MURDER. But take care that your opponents can't do the same -- take their letters, counter their actions, or call on a waiting Crow to influence the murder before they do! At any moment a well-played card can shift the balance and seal someone's fate.   Speakers include:","Gaming (Restaurant)",PUBLIC
"Under Where?! Hallaster's Tea Party... A D&D Dungeon Crawl",5/2/2014,18:00,5/2/2014,20:50,FALSE,"Come join us for the ultimate dungeon crawl through the 'Ruins of Undermountain.' Do you dare enter the playhouse of the mad wizard Hallaster? He's having a tea party and you're invited...as the entertainment. Who knows what horrors lay waiting around the next corner! This is a massive magical dungeon where players can come and go at Hallaster's whim. Come join us for as long or as short as you like.  All characters are premade (level 6+) and ready to play. D&D 3.5 rules will be used. We have the dice, you have the vice!  Speakers include:Jake Newman, Fred Lthrop","Gaming (Restaurant)",PUBLIC
"Hollywood and Licensing",5/2/2014,19:00,5/2/2014,19:50,FALSE,"Have you ever wanted to get an insider's prospective on dealing with licensing and Hollywood? Here's your chance.  Speakers include:Kevin Siembieda","Charlevoix B",PUBLIC
"3D Printing and the Tabletop Game Industry",5/2/2014,19:00,5/2/2014,19:50,FALSE,"3D Printing will change many different industries and tabletop gaming will be one of the first.  Using the copyright wars of the past 15 years as a model, we'll look at the challenges 3D printing creates for tabletop game creators and explore ways companies can embrace the technology without being hostile to their customers.Jason is the creator of tabletop game Legends of Kalidasia.  Speakers include:Jason Rutherford","Nicolet",PUBLIC
"Cash N' Guns Live!",5/2/2014,20:00,5/2/2014,20:50,FALSE,"Cash N' Guns Live is a LARPing game where everyone is a gangster. Eight to 20 players play in a public place where non-players are present. When the referee blows the whistle, all players point their hands (as if they had a gun) towards another player. Or maybe you want to throw a grenade? Team based play is required with a maximum of 20 participants per game. Rules: http://goo.gl/ZNPElW  Speakers include:Anthony Cholag","Board of Governors",PUBLIC
"Sanity Claws Radio - Live Gaming Podcast",5/2/2014,20:00,5/2/2014,21:50,FALSE,"Join the guys from Demon Lobster on the Sanity Claws Radio podcast as they debate the greatest game ever made!  Audience members are encouraged to chime in with their suggestions, support, or dissention.  The show wraps up with an audience participation version of our question-and-answer game – I Can Top That – where audience members get to ask the questions to the panelists.  With prizes and shenanigans, everyone is a winner!  Speakers include:","Charlevoix C",PUBLIC
"Cheap Shot",5/2/2014,20:00,5/2/2014,21:50,FALSE,"The gloves are off in the rummy-style game of insults. Players use the cards in hand to formulate an insult “Your Secret Boyfriend/is a drama farmer/and tells only lies.” Wham! Pow! Unless the targeted player can come up with a block card, such as “Oh grow up!,” the insult will stand as points. The more cards in the insult, the bigger the points. So, grab your toenail biting, hideous friends and duke it out with Cheap Shot or just go “Zip your pie hole”!   Speakers include:","Gaming (Restaurant)",PUBLIC
"Revolution",5/2/2014,20:00,5/2/2014,21:50,FALSE,"Blackmail the printer. Threaten the innkeeper. Bribe the priest. Welcome to Revolution!  Secretly bid against your opponents to gain the support of the people, win territory . . . and gather more Gold, Blackmail, and Force for the next round of bidding! Will you try to control the tavern or the fortress? The harbor or the plantation? Knowing where to push for support – and where to back away and let your opponents fight – is the key to victory. It's a game of bluff, counter-bluff, and surprise.  Speakers include:","Gaming (Restaurant)",PUBLIC
"BoF: Gaming Fans Meetup",5/2/2014,21:00,5/2/2014,21:50,FALSE,"Get together with your fellow gaming fans to talk games.   Speakers include:","Board of Regents",PUBLIC
"MovieMashups Tournament",5/2/2014,22:00,5/2/2014,22:50,FALSE,"In MovieMashups, teams of 2-4 players compete to prove their knowledge of mixed-up movies. The winning team will walk away with one deck of cards.  Speakers include:William Meyer, Kim Horger","Gaming (Restaurant)",PUBLIC
"The Biggest Game of Cards Against Humanity Ever Played",5/2/2014,22:00,5/3/2014,0:50,FALSE,"We're going to attempt the biggest game of Cards Against Humanity ever.  Even if you've only heard about this wild tabletop game, show up for the fun and stay for the chaos.  Speakers include:Nick Farr, M'jit Raindancer-Stahl, Dean Stahl","Gaming (Restaurant)",PUBLIC
"Gaming Without Boundaries",5/2/2014,22:00,5/2/2014,22:50,FALSE,"What happens when you are out at a restaurant, or waiting in line for a movie, and you've forgotten to bring a game to stave off boredom? This panel will teach you several games you can play with any number of people that require only a pen and paper, a few coins, or nothing at all. Puzzle games, word games, party games, strategic games, dexterity games... all can be played if you just know the rules! You'll instantly feel like you can handle any airline delay or family function without your miniatures, cards, or boards.  Speakers include:Anthony Cholag","Montcalm",PUBLIC
"Chopped GM - Penguicon",5/3/2014,10:00,5/3/2014,12:50,FALSE,"Fifteen players will have a chance to become the first winner of 'Chopped GM.' There will be four random elements to test and stretch players' creative muscles. Have you got what it takes to win the contest?  Speakers include:Bill Korsak","Gaming (Restaurant)",PUBLIC
"Rick's Big Box of Games",5/3/2014,12:00,5/3/2014,13:50,FALSE,"Pick from a variety of games and play for a while!  Options include: Munchkin, Back to the Future, Dominion, Star Trek DBG, Smallworld, Ticket to Ride, Settlers of Catan, Castle Panic, Zombies!!!, Chess, and more. Participants will select which specific games to play.  Some games have limited space, so sign-up in advance at Ops and vote for your favourite titles.  New players are welcome, as are walk-ins.  Speakers include:Richard Houser","Gaming (Restaurant)",PUBLIC
"How to be the Best GM ",5/3/2014,13:00,5/3/2014,13:50,FALSE,"Tap in the minds of 2 local GMs and find the best way to make your game session  fast paced and more memorable.  Speakers include:Kevin Siembieda, Bill Korsak","Board of Governors",PUBLIC
"Roborally",5/3/2014,13:00,5/3/2014,15:50,FALSE,"It's a slow day at the widget factory, so the central race computer has prepared a RoboRally tournament for the factory computers. You can be one of those computers! Navigate your robot across conveyor belts, over gears, and past pushers in your effort to be the first to touch all the checkpoints. But watch out for the other robots, not only are they trying to beat you to the checkpoints, but they might even try to push you off course. And don't forget the lasers mounted throughout the factory, and on each of the other robots too. Easy to learn, hard to master. This factory is definitely not approved by the UAW.  Speakers include:Mark Geary","Gaming (Restaurant)",PUBLIC
"Oh Gnome You Don't",5/3/2014,13:00,5/3/2014,14:50,FALSE,"It's adventure time for gnomes as they travel and gather items along the forest trail. Typically cheerful and friendly, the little gnomes let greed and aggression get the best of them as they get into brawls, play tricks, and set traps to be able to grab up and trade for the most gems by the end of the game. It's a Gnome-tastic Adventure!!  Speakers include:","Gaming (Restaurant)",PUBLIC
"MovieMashups Tournament",5/3/2014,14:00,5/3/2014,14:50,FALSE,"In MovieMashups, teams of 2-4 players compete to prove their knowledge of mixed-up movies. The winning team will walk away with one deck of cards.  Speakers include:William Meyer, Kim Horger","Gaming (Restaurant)",PUBLIC
"Red Neck Life",5/3/2014,14:00,5/3/2014,15:50,FALSE,"A roll of two dice determines the grade you complete in school at age 18, which sets you up for one of eleven fabulous careers such as Monster Truck Announcer or Mullet Salon Operator! Journey through Blue Collar Americana by going into debt to purchase rigs, get hitched and housed, divorced, remarried, and raise a passel of young'uns.   Speakers include:","Gaming (Restaurant)",PUBLIC
"The Haunting House",5/3/2014,14:00,5/3/2014,15:50,FALSE,"The Haunting House is a wildly fun, fast-paced, strategy board game with a twist. The object is simple: players enter the front door and race to be the first to reach the exit. It's not as easy as it sounds. Half the time the players choose their own path; the rest of the time, their paths are chosen randomly by opponents. Additionally, the board elements constantly change as the game progresses.   Speakers include:","Gaming (Restaurant)",PUBLIC
"Illuminati",5/3/2014,16:00,5/3/2014,17:50,FALSE,"Illuminati is the Game Of Conspiracy. Secret conspiracies are everywhere, and now you can take control of one of them and try to . . . yes . . . take over the world! This game has been one of our most popular since its 1982 release. It won the Game Designers' Guild Select Award and the Origins Award for Best Science Fiction Board Game, which is a good trick since it's more of a card game, but the Illuminati work in mysterious ways.  Speakers include:","Gaming (Restaurant)",PUBLIC
"Pack -n- Stack",5/3/2014,16:00,5/3/2014,17:50,FALSE,"It's moving day! You have lots of boxes to load, and a truck to load them into... but how are they going to fit? Maybe on their ends? Stacked on top of each other? You'll have to pack your unique truck as tightly as possible, and you lose points for packing too few pieces on your truck, or for leaving pieces you can't fit behind. Can you pack'em, stack'em and rack'em with the best?  Speakers include:","Gaming (Restaurant)",PUBLIC
"Under Where?! Hallaster's Tea Party... A D&D Dungeon Crawl",5/3/2014,16:00,5/3/2014,18:50,FALSE,"Come join us for the ultimate dungeon crawl through the 'Ruins of Undermountain.' Do you dare enter the playhouse of the mad wizard Hallaster? He's having a tea party and you're invited...as the entertainment. Who knows what horrors lay waiting around the next corner! This is a massive magical dungeon where players can come and go at Hallaster's whim. Come join us for as long or as short as you like.  All characters are premade (level 6+) and ready to play. D&D 3.5 rules will be used. We have the dice, you have the vice!  Speakers include:Jake Newman, Fred Lthrop","Gaming (Restaurant)",PUBLIC
"World Building",5/3/2014,17:00,5/3/2014,17:50,FALSE,"What are the best tips of making a world that is unique and sensational?  Speakers include:Kevin Siembieda","Board of Governors",PUBLIC
"Elementary, Dear Watson ",5/3/2014,18:00,5/3/2014,19:50,FALSE,"There has been a murder!  Who did it?  Use your Sherlockian wits and deductive reasoning to solve a murder mystery in a social hors d'oeuvres laden Tea and scones environment.  Dressing up is encouraged.  Find this killer before he kills YOU!  Speakers include:Selina Firecat","Board of Trustees",PUBLIC
"Annual Dominion Tournament",5/3/2014,18:00,5/3/2014,20:50,FALSE,"In this million-selling “non-collectible card game,” players start with the same simple deck, and use their hand to buy cards into their collection from the middle of the table. Whoever buys the most expensive victory cards first, wins. Winners take home plastic trays for displaying cards during play. Plan to play through two games with pre-designed sets. Please sign up at Ops, but walk ins are still welcome!  Speakers include:Matt Arnold","Gaming (Restaurant)",PUBLIC
"PowerPoint Karaoke",5/3/2014,21:00,5/3/2014,21:50,FALSE,"Players will try out their improv chops one at a time with a random slide deck which they get to present to the audience (with a time limit). Each player hangs a compelling or funny narrative on whatever art, charts, technobabble, or self-improvement jargon comes up on the slides. Volunteer from the audience! Prizes awarded!  Speakers include:Sarah Elkins, Cylithria Dubois","Algonquin D",PUBLIC
"BoF: Gamers Looking for Campaigns",5/3/2014,21:00,5/3/2014,21:50,FALSE,"Meet fellow gamers and find new adventures.   Speakers include:","Hamlin",PUBLIC
"Mad Scientist University",5/3/2014,21:00,5/3/2014,22:50,FALSE,"Do you want to test your GM creative skills? You will get four random elements and 30 minutes to create a title and game blurb to get players. Once you have players you have four hours to run the best game ever! Prizes awarded for the best GMs.  Speakers include:","Gaming (Restaurant)",PUBLIC
"Settlers of Catan",5/3/2014,21:00,5/3/2014,22:50,FALSE,"Players are recent immigrants to the newly populated island of Catan. Expand your colony through the building of settlements, roads, and villages by harvesting commodities from the land around you. Trade sheep, lumber, bricks and grain for a settlement, bricks and wood for a road, or try to complete other combinations for more advanced buildings, services and specials.  Speakers include:","Gaming (Restaurant)",PUBLIC
"Board Game Design",5/4/2014,10:00,5/4/2014,10:50,FALSE,"What does it take to design and produce a new game? We will discuss all aspects, from initial concept and mechanics to playtesting and even funding through Kickstarter. This is a Q&A panel so bring your questions!  Speakers include:Matthew Duhan, Matt Arnold","Charlevoix A",PUBLIC
"Gloom",5/4/2014,10:00,5/4/2014,11:50,FALSE,"In the Gloom card game, you assume control of the fate of an eccentric family of misfits and misanthropes. The goal of the game is sad, but simple: you want your characters to suffer the greatest tragedies possible before passing on to the well-deserved respite of death. You'll play horrible mishaps like Pursued by Poodles or Mocked by Midgets on your own characters to lower their Self-Worth scores, while trying to cheer your opponents' characters with marriages and other happy occasions that pile on positive points. The player with the lowest total Family Value wins.  Speakers include:","Gaming (Restaurant)",PUBLIC
"Humans!!!",5/4/2014,10:00,5/4/2014,11:50,FALSE,"This time you are playing the zombies and trying to infect as many people in town as possible. This game will be able to be played with Zombies!!! - some players playing humans and some players playing zombies.  Speakers include:","Gaming (Restaurant)",PUBLIC
"Do Angry Fans Ruin It?",5/4/2014,11:00,5/4/2014,11:50,FALSE,"Was Mass Effect 3 improved by the outrage of gamers? Do TV shows like Community or Top Gear need angry feedback, or are we encouraging authors, artists and designers to be less creative to avoid fan ire?  Is sequel-itis all our fault?  Speakers include:StarF, Val Hundreds, Moses Jackson, BluRaven C. Houvener","Board of Governors",PUBLIC
"Rick's Big Box of Games",5/4/2014,12:00,5/4/2014,13:50,FALSE,"Pick from a variety of games and play for a while!  Options include: Munchkin, Back to the Future, Dominion, Star Trek DBG, Smallworld, Ticket to Ride, Settlers of Catan, Castle Panic, Zombies!!!, Chess, and more. Participants will select which specific games to play.  Some games have limited space, so sign-up in advance at Ops and vote for your favourite titles.  New players are welcome, as are walk-ins.  Speakers include:Richard Houser","Gaming (Restaurant)",PUBLIC
"Titans of Industry",5/4/2014,12:00,5/4/2014,14:50,FALSE,"In Titans of Industry, you must invest in building factories and businesses (in the 1920's) in order to produce goods to gain victory points (VPs). Game play involves a delicate balance of money, production, and goals. The person who can best manage his buildings and meet his goals in seven years will win.
  Speakers include:Matthew Duhan","Gaming (Restaurant)",PUBLIC
"Munchkin Everything",5/4/2014,12:00,5/4/2014,13:50,FALSE,"Munchkin is the mega-hit card game about dungeon adventure . . . with none of that stupid roleplaying stuff. You and your friends compete to kill monsters and grab magic items. And what magic items! Don the Horny Helmet and the Boots of Butt-Kicking. Wield the Staff of Napalm . . . or maybe the Chainsaw of Bloody Dismemberment. Start by slaughtering the Potted Plant and the Drooling Slime, and work your way up to the Plutonium Dragon . . .  Speakers include:","Gaming (Restaurant)",PUBLIC
"Richard's Big Box of Games",5/4/2014,12:00,5/4/2014,13:50,FALSE,"Pick from the big box of games and play for a while! Options include: Munchkin, Back to the Future, Dominion, Star Trek DBG, Smallworld, Ticket to Ride Europe, Settlers of Catan, and Castle Panic. Participants will select what games to play.
  Speakers include:Richard Houser","Gaming (Restaurant)",PUBLIC
"Pen and Paper Game Design",5/4/2014,13:00,5/4/2014,13:50,FALSE,"Meet local designer Kevin Siembieda and tap his mind for ways to design your own games.  Speakers include:Kevin Siembieda","Hamlin",PUBLIC
"Whose Geek are You Anyway?",5/4/2014,14:00,5/4/2014,14:50,FALSE,"Bringing it back due to the overwhelming request - Come join in Who's Line Is It Anyway style sketches, with a twist!  Ever wonder what would happen if you got Superman and Lex Luthor on Jerry Springer?  What if Spock had to hold a press conference apologizing for all Kirk's indiscretions?  Expect some wild and off the wall topics and skits, and laughs for all!  Speakers include:Derek Newland","Charlevoix B",PUBLIC
"Family Business",5/4/2014,14:00,5/4/2014,15:50,FALSE,"Be the boss in this fast-paced card game of survival on the mean streets. 'Family Business' pits mobsters against each other - all working to make sure theirs is the last family standing!  Speakers include:","Gaming (Restaurant)",PUBLIC
"Let's Kill",5/4/2014,14:00,5/4/2014,15:50,FALSE,"Have you ever had the urge to start beating some know-it-all who really deserved it, but were held back by those frustrating social boundaries? Ever wanted to go psycho on a bunch of bleached-blonde cheerleaders, or the pretentious beatnick at the corner coffee shop? Ever wanted to achieve fame through your horrifying actions? This game may help relieve that urge. In Let's Kill you play a psychotic killer determined to kill as many people as possible in the most bizarre ways you can think of, using everything from sporks to weed whackers to industrial paper shredders, while gaining as much media coverage as you can.   Speakers include:","Gaming (Restaurant)",PUBLIC
"MovieMashups Tournament",5/4/2014,15:00,5/4/2014,15:50,FALSE,"In MovieMashups, teams of 2-4 players compete to prove their knowledge of mixed-up movies. The winning team will walk away with one deck of cards.  Speakers include:William Meyer, Kim Horger","Gaming (Restaurant)",PUBLIC
