Subject,Start Date,Start Time,End Date,End Time,All Day Event,Description,Location,Private
"The Trials and Tribulations of the Artist's Lifestyle",4/26/2015,9:00,4/26/2015,9:50,FALSE,"Join BluRaven C. Houvener (writer and illustrator of the Webcomic It's Just Another Day) and Gabrielle Nettles (Founder of Bad Catholic Films LLC) for another year of laugh out loud mayhem as they regale you with tales of success and failure that they've faced reaching towards fame and fortune. Comments and questions are encouraged!  Speakers include:Jennifer Hamilton, Gabrielle Nettles, BluRaven Houvener","Portage Auditorium",PUBLIC
"Crowdfunding Your Way to Success",4/26/2015,14:00,4/26/2015,15:50,FALSE,"Crowdfunding has taken the world by storm. Learn about the different types of crowdfunding and the ways they can help your project become a reality.  Speakers include:Maggie Maiville, Sarah Hans","Windover",PUBLIC
"You...You Don't Like My Webcomic?",4/25/2015,18:00,4/25/2015,18:50,FALSE,"Sadly it happens to us all at one time or another...and people aren't always so kind about it! Join Laura Cascos and Erika Wagner (the team behind the amazing Webcomic Sidekick Girl) and BluRaven C. Houvener (writer and illustrator of It's Just another day) as they walk you through the ins and outs of how to cope with criticism and survive to create another day!    Speakers include:BluRaven Houvener, Laura Cascos, Erika Wagner","Nicolet",PUBLIC
"Webcomic Underdogs Meet and Greet",4/25/2015,21:00,4/25/2015,21:50,FALSE,"Webcomic Underdogs is an online organization with the mission of bringing together underground webcomic artists, writers, and publishers. Join us for a fun, exciting, and informational meet and greet that hopes to bring together many webcomic lovers and makers, and educate those that are interested in webcomics but have never quite known where to start.  Speakers include:BluRaven Houvener","Charlevoix C",PUBLIC
"Learn to Draw a Dragon",4/26/2015,9:00,4/26/2015,9:50,FALSE,"Join Terry Pavlet as he teaches you how to draw a dragon!  Speakers include:Terry Pavlet","Board of Trustees",PUBLIC
"The Trials and Tribulations of the Artist's Lifestyle",4/26/2015,9:00,4/26/2015,9:50,FALSE,"Join BluRaven C. Houvener (writer and illustrator of the Webcomic It's Just Another Day) and Gabrielle Nettles (Founder of Bad Catholic Films LLC) for another year of laugh out loud mayhem as they regale you with tales of success and failure that they've faced reaching towards fame and fortune. Comments and questions are encouraged!  Speakers include:Jennifer Hamilton, Gabrielle Nettles, BluRaven Houvener","Portage Auditorium",PUBLIC
"Comics vs. Manga? Is There Really a Difference?",4/26/2015,10:00,4/26/2015,10:50,FALSE,"An in depth discussion of these two visual mediums. Is an ocean the only thing that separates them, or is it so much more?  Speakers include:Cassy Sinke, BluRaven Houvener","Charlevoix B",PUBLIC
"Webcomic Reading",4/26/2015,12:00,4/26/2015,12:50,FALSE,"Got a webcomic you love with all your heart that you'd just love to see read aloud by random people most likely snickering and giving funky voices to your beloved characters? Then come on in!  Speakers include:BluRaven Houvener","Nicolet",PUBLIC
"Crowdfunding Your Way to Success",4/26/2015,14:00,4/26/2015,15:50,FALSE,"Crowdfunding has taken the world by storm. Learn about the different types of crowdfunding and the ways they can help your project become a reality.  Speakers include:Maggie Maiville, Sarah Hans","Windover",PUBLIC
